id,question,ground_truth_letter,baseline_think,baseline_answer,loop_failure,truncation_failure
14,"Researchers are attempting to detect transits of two Earth-like planets: Planet_1 and Planet_2. They have limited observing time and want to observe the one that has the highest probability of transiting. Both of these planets have already been detected via the RV method, allowing us to know their minimum masses and orbital periods. Although both planets share the same masses, the orbital period of Planet_1 is three times shorter than that of Planet_2. Interestingly, they both have circular orbits. Furthermore, we know the masses and radii of the host stars of these two planets. The star hosting Planet_1 has a mass that is twice that of the host star of Planet_2. As the host of Planet_2 is slightly evolved, both host stars have the same radii. Based on the provided information, the researchers have chosen to observe:",D,"Alright, so I'm trying to figure out which planet, Planet_1 or Planet_2, has a higher probability of transiting based on the given information. Let's break it down step by step.

First, both planets are Earth-like, detected via the RV method, which gives us their minimum masses and orbital periods. That's important because transiting planets are often detected by their ability to block the star's light during an alignment, which depends on their orbital periods relative to the star's rotation.

The key points are:

1. **Orbital Periods**: Planet_1's orbital period is three times shorter than Planet_2's. So, if Planet_2's period is, say, P, Planet_1's is P/3.

2. **Star Masses**: The host star of Planet_1 has twice the mass of Planet_2's host star. So, M1 = 2*M2.

3. **Orbital Period and Transit Probability**: The transit probability depends on how often the planet's orbit brings it in front of the star. For a circular orbit, the probability of transit depends on the relative sizes of the planet and the star. However, since both planets have the same radii (as stated), the transit probability would be based on the alignment relative to the orbital period and the star's size.

Wait, but transit probability also depends on the size of the planet relative to the star. Since both have the same radii, that factor cancels out, so it's about how often the planet's orbit brings it in front of the star during transit.

For a circular orbit, the probability of a transit is higher for shorter orbital periods because the planet comes closer to the star more frequently. So, a shorter orbital period would mean a higher chance of transiting because the planet is moving faster, leading to more frequent alignment with the star's disk.

But wait, the transit probability isn't just about the orbital period but also about the star's size and the planet's orbital distance. Since both stars have the same radius, and the planets are Earth-like, the key factor is the orbital period and the star's mass affecting the planet's orbital speed.

Wait, let me think again. The transit probability for a planet in a circular orbit is generally proportional to the ratio of the star's radius to the planet's orbital radius. But since the star's radii are the same, the probability would be proportional to the planet's orbital radius relative to the star. However, the planet's orbital radius is determined by its orbital period and the star's mass and distance.

Alternatively, considering Kepler's third law, which relates the orbital period to the semi-major axis. For circular orbits, the formula is P² = (4π²/G(M+m))a³, but since M (planet's mass) is negligible compared to the star's mass, we can approximate it as P² ∝ a³ / M_star. So, the orbital period squared is proportional to the cube of the semi-major axis divided by the star's mass.

But since both planets have the same radius, the transit probability depends on how often the planet's orbit brings it in front of the star. For a circular orbit, the transit probability is proportional to the ratio of the planet's orbital radius to the star's radius. However, since the star's radii are the same, it's about how close the planet is to the star during transit.

Alternatively, the transit probability is also influenced by the relative speed of the planet across the star's disk. Since the orbital period is shorter for Planet_1, it moves faster, so it spends more time in front of the star's disk, increasing the probability.

But wait, transit probability also depends on the star's size and the planet's size. Since both planets have the same radius, the star's size is the same, so the transit probability is primarily about how often the planet passes in front of the star. For a circular orbit, the probability is higher for shorter orbital periods because the planet is moving faster, leading to more frequent alignments.

So, Planet_1 has a shorter orbital period, which means it's moving faster and thus more likely to transit. Therefore, Planet_1 has a higher probability of transiting.

Looking at the options, option A says Planet_1 is preferred due to its ~2.7 times higher probability. That seems plausible because the shorter orbital period increases the transit probability.

But let me double-check. The transit probability for a planet in a circular orbit is given by P_transit ∝ (R_planet / a)², where a is the semi-major axis. Since R_planet is the same for both planets, the transit probability is inversely proportional to the square of the semi-major axis. However, the semi-major axis a is determined by Kepler's third law: a³ ∝ P² / M_star. So, a ∝ (P² / M_star)^(1/3). Therefore, a ∝ (P³ / M_star)^(1/3). Since M_star for Planet_1 is twice that of Planet_2, and P_1 is three times shorter than P_2, let's see:

For Planet_1: a1 ∝ (P1³ / M1)^(1/3) = ( (3P2)^3 / (2M2) )^(1/3) ) = (27 P2³ / 2M2)^(1/3) = (27/2)^(1/3) * (P2³ / M2)^(1/3) ) = (27/2)^(1/3) * a2

Similarly, a2 ∝ (P2³ / M2)^(1/3)

So, a1 = (27/2)^(1/3) * a2 ≈ (13.5)^(1/3) ≈ 2.37 times a2

Therefore, a1/a2 ≈ 2.37

So, the transit probability P_transit ∝ (R_planet / a)². Since R_planet is the same, P_transit ∝ 1/a² ∝ (a2/a1)² ≈ (2.37)² ≈ 5.61

Wait, that would mean Planet_1 has a lower transit probability because a1 is longer than a2, but this contradicts my earlier thought.

Wait, let's clarify. If a1 is larger than a2, then the transit probability would be lower because the planet is further away, so it spends less time in front of the star. But earlier I thought that a shorter orbital period leads to a higher probability because the planet moves faster, so it aligns more often.

Hmm, perhaps the two factors are conflicting. Let's think about it differently. The transit probability for a planet is given by the ratio of the planet's orbital radius to the star's radius, which is a / R_star. Since R_star is the same for both, it's proportional to a. But a is related to P via Kepler's third law. So, a ∝ (P² / M_star)^(1/3). Therefore, a1/a2 = (P1³ / M1)^(1/3) / (P2³ / M2)^(1/3) ) = ( (P1/P2)^3 * (M2/M1) )^(1/3) )

Given that P1 = P2 / 3, so P1/P2 = 1/3, and M1 = 2 M2.

So, a1/a2 = ( ( (1/3)^3 ) * (M2 / 2 M2) )^(1/3) ) = ( (1/27) * (1/2) )^(1/3) ) = (1/54)^(1/3) ≈ 0.27

Wait, that suggests a1 is about 0.27 times a2, meaning a1 is shorter than a2. But that contradicts the earlier assumption that shorter orbital period implies faster movement.

Wait, perhaps I made a mistake in the formula. Let me double-check Kepler's third law for circular orbits: P² = (4π²/G(M+m))a³. Since the planet's mass is negligible, it's P² ∝ a³ / M_star. So, a³ ∝ P² * M_star.

Therefore, a ∝ (P² * M_star)^(1/3) = P^(2/3) * M_star^(1/3)

So, for Planet_1 and Planet_2:

a1 ∝ P1^(2/3) * M1^(1/3) = (P2/3)^(2/3) * (2M2)^(1/3) ) = (P2^(2/3) / 3^(2/3)) * (2^(1/3) M2^(1/3)) )

a2 ∝ P2^(2/3) * M2^(1/3)

So, a1/a2 = (2^(1/3) / 3^(2/3)) ) ≈ (1.26 / 2.08) ≈ 0.605

So, a1 is approximately 0.605 times a2, meaning a1 is shorter than a2.

But that would mean that Planet_1 is closer to the star than Planet_2, so it should have a higher transit probability because it's moving faster and aligning more often.

Wait, but earlier I thought that shorter orbital period means faster movement, so it should be more likely to transit. But according to this calculation, a1",,True,True
15,"How many of the following compounds will exhibit optical activity?

(Z)-1-chloro-2-methylbut-1-ene
(3aR,7aS,E)-8-(chloromethylene)hexahydro-4,7-methanoisobenzofuran-1,3-dione
(2R,3S)-2,3-dimethylsuccinic acid
(2R,3R)-2,3-dimethylsuccinic acid
(R)-cyclohex-3-en-1-ol
(1s,3s,5s)-cyclohexane-1,3,5-triol
1-cyclopentyl-3-methylbutan-1-one",C,"Alright, I'm trying to figure out how many of these compounds exhibit optical activity. Optical activity involves the ability of a compound to rotate plane-polarized light, which typically happens when the compound has chiral centers or a plane of symmetry that's broken by a stereogenic center. 

Let's go through each compound one by one.

1. (Z)-1-chloro-2-methylbut-1-ene: This is an alkene, which has a double bond. Alkenes are generally not chiral because the carbons are connected by a double bond, and there's no chiral center here. So, no optical activity.

2. (3aR,7aS,E)-8-(chloromethylene)hexahydro-4,7-methanoisobenzofuran-1,3-dione: This looks like a complex bicyclic structure with multiple rings and substituents. The presence of multiple rings and the possibility of a chiral center here suggests that it might be chiral. However, I'm not entirely sure without drawing it out, but I'll tentatively mark it as having optical activity.

3. (2R,3S)-2,3-dimethylsuccinic acid: This is a dihydroxy acid.succinic acid has two hydroxyl groups opposite each other. The stereochemistry here is defined by the two chiral centers. Since both centers are chiral, this compound should exhibit optical activity.

4. (2R,3R)-2,3-dimethylsuccinic acid: Similar to the third compound, but here both chiral centers are R. Still, each center is chiral, so this should also exhibit optical activity.

5. (R)-cyclohex-3-en-1-ol: This is an alcohol with a cyclohexene ring. The double bond here can lead to possible geometric isomerism, but since it's a single double bond, it's not a chiral center. However, the alcohol group might not create a chiral center on its own. So, probably no optical activity.

6. (1s,3s,5s)-cyclohexane-1,3,5-triol: This is a triol with three hydroxyl groups at positions 1,3,5 on a cyclohexane ring. Each OH group is attached to a carbon, and the ring has three OHs. This setup creates a situation where the molecule could have a plane of symmetry if the arrangement is symmetric. Wait, actually, in a six-membered ring with OHs at 1,3,5, that's a trigonal symmetry. Depending on the arrangement, it might be chiral. But wait, in a ring, if each OH is in a position that breaks the plane of symmetry, it might be chiral. Alternatively, if all OHs are in positions that create a plane of symmetry, it wouldn't be chiral. I'm a bit confused here. Let me think: if the molecule is symmetric, like having OHs at positions that are mirror images, then it might not be chiral. But in this case, the positions are 1,3,5, which are all opposite each other in a six-membered ring. Wait, actually, in a six-membered ring with OHs at 1,3,5, each OH is opposite another OH, so the molecule would have a plane of symmetry. Therefore, it's not chiral. So no optical activity.

7. 1-cyclopentyl-3-methylbutan-1-one: This is a ketone with a cyclopentyl group and a methyl group. The cyclopentyl group is a ring, and the methyl is attached to the butanone. The ketone is at the end, so the carbonyl is at the end of the chain. There's no chiral center here because the carbonyl is at the end, and the rest of the structure doesn't have a chiral center. So no optical activity.

8. (1s,3s,5s)-cyclohexane-1,3,5-triol: As I thought earlier, this molecule has OH groups at 1,3,5. If the molecule is symmetric with OHs at these positions, it might be achiral. Alternatively, if the arrangement breaks the symmetry, it could be chiral. But in this case, since each OH is opposite another OH, it would create a plane of symmetry, making it achiral. So no optical activity.

So, out of the eight compounds, only the second and third compounds are definitely chiral, and the sixth might be chiral if the arrangement breaks the plane of symmetry. Wait, let me reevaluate the sixth compound. If it's (1s,3s,5s)-cyclohexane-1,3,5-triol, each OH is at a position that breaks the ring symmetry. For example, if the molecule isn't symmetric, then it can have a chiral center. But wait, in a six-membered ring with OHs at 1,3,5, each OH is adjacent to two other OHs. So, the molecule might have a center of inversion. Alternatively, it could have a center of rotation. Wait, I'm getting confused. Let me think: in a cyclohexane ring, if each OH is in a position that is not symmetric, then it might have a chiral center. Alternatively, if the arrangement is such that it's symmetric, it's not chiral. But in this case, since each OH is opposite another OH, the molecule might have a plane of symmetry. For example, if you rotate the ring 180 degrees, the OHs would align. Therefore, it would be achiral. So, no optical activity.

Wait, but the question is about optical activity, which is about having a chiral center or a plane of symmetry that's broken by a stereogenic center. So, if the molecule has a plane of symmetry, it's not chiral. If it has a chiral center, it's chiral. So, for the sixth compound, if there's no chiral center, then it's not chiral. But I'm not sure if it has a chiral center. Let me think: each OH is attached to a carbon. The carbons are at positions 1,3,5. Each of these carbons is connected to two other carbons and one OH. So, each of these carbons is a potential chiral center. Wait, but in this case, each OH is in a position that breaks the symmetry. Let me try to visualize: if the molecule is symmetric, then it's not chiral. If it's asymmetric, then it is. So, for example, in a molecule with three OHs at 1,3,5, each of these carbons is attached to two other carbons. So, each carbon has four substituents: two carbons, one OH, and one hydrogen. Wait, no, each carbon in the ring is connected to two adjacent carbons. So, each carbon in the ring is connected to two carbons and one OH. Wait, no, each carbon in the ring is connected to two adjacent carbons and one OH. So, each carbon is bonded to two other carbons and one OH. So, each carbon is bonded to two carbons and one OH, making it a chiral center. So, if each of these carbons is a chiral center, then the molecule is chiral. But wait, in a six-membered ring, having OHs at 1,3,5 would make each of those carbons have a chiral center. So, that's three chiral centers, making the molecule chiral. Therefore, this compound would exhibit optical activity.

So, going back, let's correct my earlier assessment:

1. No optical activity.
2. Yes, chiral center.
3. Yes, chiral centers.
4. Yes, chiral centers.
6. Yes, chiral centers.
7. No optical activity.
8. No optical activity.

Wait, but earlier I thought about compound 6. Let me clarify: in a six-membered ring with OHs at 1,3,5, each of those carbons is a chiral center because they have four different substituents: two adjacent carbons, one OH, and one hydrogen. So, yes, each of those carbons is a chiral center. Therefore, compound 6 is chiral.

So, the correct compounds with optical activity are:

2, 3, 6, and perhaps 4. Wait, let's check compound 4: (2R,3R)-2,3-dimethylsuccinic acid. Each of the two chiral centers is R. So, each is a chiral center, so this is chiral.

Similarly, compound 3: (2R,3S)-2,3-dimethylsuccinic acid, each chiral center is R and S, so it's chiral.

So, the chiral centers are in compounds 2,3,4,6.

Wait, but earlier I thought compound 6 might not be chiral because of symmetry. Let me double-check. If the molecule is symmetric, then it's not chiral. For example, if the OHs are opposite each other, then rotating the molecule 180 degrees would map the molecule onto itself, making it achiral. So, in compound 6, since each OH is opposite another, the molecule is symmetric, so it's not chiral. Therefore, compound 6 is not chiral.

Therefore, the chiral compounds are:

2,3,4.

So, three compounds exhibit optical activity.",The,True,False
16,"What is the concentration of calcium ions in a solution containing 0.02 M stochiometric Ca-EDTA complex (we assume that the pH is ideal, T = 25 °C). KCa-EDTA = 5x10^10.",A,"Okay, so I have this chemistry problem here about the concentration of calcium ions in a solution containing a stochiometric Ca-EDTA complex. Let me try to figure this out step by step. 

First, I remember that EDTA is the EDTA chelator, which forms complexes with metal ions. In this case, the metal ion is calcium (Ca²+), and the EDTA is in a 1:1 ratio with calcium, meaning each EDTA molecule binds one calcium ion. So, the complex is Ca²+EDTA^4-, right? Because EDTA is a hexadentate ligand with a charge of -4, so Ca²+ would balance that.

The problem states that the solution is stochiometric, which I think means that the amount of EDTA is exactly enough to form a 1:1 complex with the calcium ions. So, for every mole of Ca²+, there's one mole of EDTA. That makes sense because they're in a 1:1 ratio.

The concentration of the complex is given as 0.02 M. Wait, no, actually, the complex is 0.02 M, but since it's 1:1, the concentration of Ca²+ and EDTA^4- would also be 0.02 M each. But wait, that might not be correct because the solution might have more EDTA around, but in a stochiometric situation, they're in exact amounts.

Now, the key here is the formation constant (Kf) of Ca²+ with EDTA. The problem gives KCa-EDTA = 5x10^10. I think the formation constant tells us how much the complex dissociates from the metal ion. A large Kf means the complex dissociates less, so the metal ion concentration is higher. 

The formula I remember is the one that relates the concentration of metal ions to the complex concentration. It's something like [Ca²+] = Kf * [Ca-EDTA] * [EDTA^4-] / [Ca²+]^something? Wait, maybe I should write it out properly.

The formation constant expression for Ca²+ with EDTA is:

Ca²+ + EDTA^4- ↔ Ca-EDTA^2- 

But wait, EDTA^4- is a complex ion itself, so maybe I should consider it as EDTA^4- and Ca²+ forming the complex Ca-EDTA^2-.

The formation constant Kf is given by:

Kf = [Ca-EDTA^2-] / ([Ca²+][EDTA^4-])

In a solution where EDTA is in excess and the complex is stochiometric, the concentration of EDTA^4- is much higher than the complex, so we can approximate [EDTA^4-] as constant. Let's denote it as [EDTA] = C.

So, substituting into the equation:

[Ca-EDTA^2-] = Kf * [Ca²+] * [EDTA]

But wait, since the complex is stochiometric, [Ca-EDTA^2-] = [Ca²+] = 0.02 M.

Wait, no, that can't be right because if the complex is 0.02 M, then [Ca²+] would be 0.02 M, but that would mean the EDTA is also 0.02 M, but EDTA is a stronger base, so it should be in excess.

Wait, I think I'm confusing something here. Let me clarify.

In a solution where EDTA is in excess and the complex is stochiometric, the concentration of the complex [Ca-EDTA^2-] equals the concentration of free EDTA [EDTA]. Because each EDTA binds one Ca²+. So, [Ca-EDTA^2-] = [Ca²+] = 0.02 M.

Wait, no, because in a 1:1 complex, for every mole of Ca²+, there's one mole of EDTA. So, [Ca²+] = [EDTA] = 0.02 M.

But wait, that doesn't make sense because EDTA is a stronger ligand and would be in excess, so maybe I should set up the equation differently.

Let me think again. The formation constant Kf = [Ca-EDTA^2-] / ([Ca²+][EDTA^4-])

But since the solution is stochiometric, the amount of EDTA is sufficient to form the complex in a 1:1 ratio. So, [Ca-EDTA^2-] = [Ca²+] = 0.02 M. And [EDTA^4-] is much higher, so we can approximate it as a constant.

Wait, but if [Ca-EDTA^2-] = [Ca²+] = 0.02 M, then:

Kf = [Ca-EDTA^2-] / ([Ca²+][EDTA^4-]) = 5x10^10

So,

0.02 = 5x10^10 * (0.02) * [EDTA^4-]

Wait, but that would mean [EDTA^4-] = (0.02) / (5x10^10 * 0.02) = 1/(5x10^10) which is a very small number, but that doesn't make sense because EDTA is in excess.

Wait, maybe I'm approaching this wrong. Let's consider the total EDTA concentration as [EDTA] = [EDTA^4-] + [EDTA^3-] + [EDTA^2-] + [EDTA^-] + [EDTA^0], but since EDTA is a hexadentate ligand and the solution is buffered, the major species are EDTA^4- and maybe some EDTA^3- or lower. But in a stochiometric solution, maybe the major species are EDTA^4- and some EDTA^3-.

Wait, but the problem states it's stochiometric, meaning that the concentration of EDTA is exactly enough to form the complex in a 1:1 ratio with Ca²+. So, [Ca-EDTA^2-] = [Ca²+] = 0.02 M. And [EDTA^4-] is part of the EDTA concentration.

Wait, but EDTA can exist in different forms. The formation constant accounts for the formation of the complex, so the total EDTA concentration is [EDTA] = [EDTA^4-] + [EDTA^3-] + ... But in a stochiometric solution, perhaps [EDTA] is primarily [EDTA^4-], but I'm not sure.

Wait, maybe it's better to set up the equation correctly. The formation constant Kf is given by:

Kf = [Ca-EDTA^2-] / ([Ca²+][EDTA^4-])

Assuming that [Ca-EDTA^2-] = [Ca²+] = 0.02 M, and [EDTA^4-] is much larger, so we can approximate [EDTA^4-] as [EDTA] ≈ [Ca-EDTA^2-] = 0.02 M. Wait, no, that would make [EDTA] = 0.02 M, but EDTA is a hexadentate ligand and in excess, so this might not be correct.

Wait, perhaps I should set up the equation properly. Let me denote [Ca²+] = x, [EDTA^4-] = C, and [Ca-EDTA^2-] = Kf * x * C.

But since the solution is stochiometric, x = [Ca-EDTA^2-] = [Ca²+] = 0.02 M. So,

0.02 = Kf * 0.02 * C

Which simplifies to:

0.02 = 5x10^10 * 0.02 * C

Divide both sides by 0.02:

1 = 5x10^10 * C

So,

C = 1 / (5x10^10) = 2x10^-11 M

But wait, that's a very small concentration, but EDTA is a hexadentate ligand and would have multiple forms. So, perhaps this approach is incorrect because I'm assuming [Ca-EDTA^2-] = [Ca²+] = 0.02 M, which might not be accurate.

Wait, maybe I should consider that in a solution where EDTA is in excess and the complex is stochiometric, the concentration of the complex [Ca-EDTA^2-] equals [Ca²+] = 0.02 M, and [EDTA^4-] is approximately equal to the total EDTA concentration minus the complex. But this might complicate things.

Alternatively, perhaps the correct approach is to consider that in a 1:1 complex, the concentration of Ca²+ is equal to the concentration of EDTA^4- in the complex, so both are 0.02 M. But EDTA is a hexadentate ligand and would exist in multiple forms, so the total EDTA concentration would be higher than 0.02 M.

Wait, maybe I should set up the equation using the formation constant correctly. Let me denote:

[",,True,True
